### ISSUE TITLE
Client disappearing

### ISSUE THREAD

**Issue by Rudd-O** [RobustPerception/PushProx#10]
GC of client that was still running took place out of nowhere:

```
level=error ts=2017-10-03T09:21:09.446332474Z caller=proxy.go:97 msg="Responded to /clients" client_count=1
level=info ts=2017-10-03T09:21:28.653546534Z caller=coordinator.go:179 msg="GC of clients completed" deleted=0 remaining=1
level=info ts=2017-10-03T09:22:28.653595779Z caller=coordinator.go:179 msg="GC of clients completed" deleted=0 remaining=1
level=info ts=2017-10-03T09:23:28.653617421Z caller=coordinator.go:179 msg="GC of clients completed" deleted=0 remaining=1
level=info ts=2017-10-03T09:24:28.653431992Z caller=coordinator.go:179 msg="GC of clients completed" deleted=0 remaining=1
level=info ts=2017-10-03T09:25:28.653501368Z caller=coordinator.go:179 msg="GC of clients completed" deleted=0 remaining=1
level=info ts=2017-10-03T09:26:28.653597843Z caller=coordinator.go:179 msg="GC of clients completed" deleted=1 remaining=0
level=info ts=2017-10-03T09:27:28.653382959Z caller=coordinator.go:179 msg="GC of clients completed" deleted=0 remaining=0
```

Client is *still running*.

Restarting proxy re-registers the client as the client retries.

**Comment by Rudd-O** [comment]
Disappears after 5 minutes:

```
level=info ts=2017-10-03T11:00:17.657654193Z caller=proxy.go:104 msg=Listening address=:8080
level=info ts=2017-10-03T11:00:18.079916119Z caller=coordinator.go:110 msg=WaitForScrapeInstruction fqdn=
level=error ts=2017-10-03T11:00:22.815177936Z caller=proxy.go:97 msg="Responded to /clients" client_count=1
level=info ts=2017-10-03T11:01:17.657898105Z caller=coordinator.go:179 msg="GC of clients completed" deleted=0 remaining=1








level=info ts=2017-10-03T11:02:17.657956693Z caller=coordinator.go:179 msg="GC of clients completed" deleted=0 remaining=1
level=info ts=2017-10-03T11:03:17.657939787Z caller=coordinator.go:179 msg="GC of clients completed" deleted=0 remaining=1
level=info ts=2017-10-03T11:04:17.657922462Z caller=coordinator.go:179 msg="GC of clients completed" deleted=0 remaining=1
level=info ts=2017-10-03T11:05:17.657942618Z caller=coordinator.go:179 msg="GC of clients completed" deleted=0 remaining=1
level=info ts=2017-10-03T11:06:17.657953134Z caller=coordinator.go:179 msg="GC of clients completed" deleted=1 remaining=0
```

**Comment by Rudd-O** [comment]
Found the bug!

```
14:37:52.252929 IP6 (flowlabel 0x15289, hlim 64, next-header TCP (6) payload length: 20) localhost.45382 > localhost.webcache: Flags [.], cksum 0x001c (incorrect -> 0xb091), seq 1, ack 1, win 683, length 0
`.R....@.................................F..Qo..g.~qP.......
14:37:52.253125 IP6 (flowlabel 0x15289, hlim 64, next-header TCP (6) payload length: 167) localhost.45382 > localhost.webcache: Flags [P.], cksum 0x00af (incorrect -> 0x3fcb), seq 1:148, ack 1, win 683, length 147: HTTP, length: 147
	POST //poll HTTP/1.1
	Host: engineering:8080
	User-Agent: Go-http-client/1.1
	Content-Length: 9
	Content-Type: 
	Accept-Encoding: gzip
	
	localhost[!http]
`.R....@.................................F..Qo..g.~qP.......POST //poll HTTP/1.1
Host: engineering:8080
User-Agent: Go-http-client/1.1
Content-Length: 9
Content-Type: 
Accept-Encoding: gzip

localhost
14:37:52.253136 IP6 (flowlabel 0x2a7e9, hlim 64, next-header TCP (6) payload length: 20) localhost.webcache > localhost.45382: Flags [.], cksum 0x001c (incorrect -> 0xafed), seq 1, ack 148, win 700, length 0
`......@...................................Fg.~qQo.cP.......
14:37:52.253346 IP6 (flowlabel 0x2a7e9, hlim 64, next-header TCP (6) payload length: 168) localhost.webcache > localhost.45382: Flags [P.], cksum 0x00b0 (incorrect -> 0x0b5e), seq 1:149, ack 148, win 700, length 148: HTTP, length: 148
	HTTP/1.1 301 Moved Permanently
	Location: /poll
	Date: Tue, 03 Oct 2017 12:37:52 GMT
	Content-Length: 0
	Content-Type: text/plain; charset=utf-8
	
`......@...................................Fg.~qQo.cP.......HTTP/1.1 301 Moved Permanently
Location: /poll
Date: Tue, 03 Oct 2017 12:37:52 GMT
Content-Length: 0
Content-Type: text/plain; charset=utf-8


14:37:52.253357 IP6 (flowlabel 0x15289, hlim 64, next-header TCP (6) payload length: 20) localhost.45382 > localhost.webcache: Flags [.], cksum 0x001c (incorrect -> 0xaf59), seq 148, ack 149, win 700, length 0
`.R....@.................................F..Qo.cg...P.......
14:37:52.253485 IP6 (flowlabel 0x15289, hlim 64, next-header TCP (6) payload length: 177) localhost.45382 > localhost.webcache: Flags [P.], cksum 0x00b9 (incorrect -> 0xb147), seq 148:305, ack 149, win 700, length 157: HTTP, length: 157
	GET /poll HTTP/1.1
	Host: engineering:8080
	User-Agent: Go-http-client/1.1
	Content-Type: 
	Referer: http://engineering:8080//poll
	Accept-Encoding: gzip
	
`.R....@.................................F..Qo.cg...P.......GET /poll HTTP/1.1
```

**Comment by Rudd-O** [comment]
if the URL in the cmd line is http://localhost:8080/, then the URL is being concatenated without removing the forward slash of `/poll`, and that causes problems.  Without the ending forward slash in the URL, it works.

What would be the fix?

**Comment by Rudd-O** [comment]
Whatever endpoint Prometheus did not scrape gets garbage-collected after five minutes.  This means that a Prometheus outage of more than five minutes makes the proxy think the app has disappeared altogether.

**Comment by Rudd-O** [comment]
Can the GC thread clean up *and close the connection* so the client can reconnect if it's still alive?  The client isn't getting any signal that the connection has been closed, and thus never attempts to reconnect.

**Comment by Conorbro** [comment]
Thanks for highlighting and debugging this issue!

I'm working on a fix for this now to join the paths correctly and avoid this bug.

**Comment by Rudd-O** [comment]
Awesome, but this is the bug about the disappearing client.  The improperly joined URL is #9.

**Comment by Conorbro** [comment]
Sorry about that. I meant to comment on issue #9 ! 

I'll take a look into this as well. Thanks for reporting!

**Comment by toerb** [comment]
I think this issue should be reopened because the current behaviour is not consistent.
When prometheus is not scraping a client for a few minutes, the client will disappear from the /clients list until the client restarts or prometheus scrapes it again.
Since /clients is often used to generate the scraping configuration for prometheus the disappeared clients will also be dropped from the configuration.
So the only way to restore the system to a functional state is by restarting of the client.

In my understanding a client should only be dropped from the /clients list, when the client is unreachable or not running anymore.

**Comment by sjal** [comment]
> In my understanding a client should only be dropped from the /clients list, when the client is unreachable or not running anymore.

Exactly, now it's kinda useless compared to what Brian wrote about getting it off wget via cron. I have some blackbox exporters and they dissapear all the time

**Comment by claytono** [comment]
I'm seeing the same issue.  It seems like the GC process should close the client connection if it removes it from the config.

**Comment by brian-brazil** [comment]
Do you want to send a PR?

**Comment by claytono** [comment]
Sure, I can give it a shot.  I was just getting up to speed on the code.  If you've got any suggestions what might be a good way to fit this in, I'd be happy to hear it.  My thoughts so far were to try to cancel the context when removing a known client, or to try to renew the timestamp when keepalives are seen.   I'm not yet sure how practical either approach is at this point.

**Comment by brian-brazil** [comment]
Probably better to keep it around if it's still working.
