### ISSUE TITLE
Empty FQDN in clients list

### ISSUE THREAD

**Issue by Rudd-O** [RobustPerception/PushProx#9]
```
 user 暭 curl http://engineering:8080/clients
[{"targets":[""],"labels":null}]
 ~/src/go 暭 
 user 暭 
```

with

```
 user 暭 bin/client --proxy-url=http://engineering:8080/ --log.level=debug --fqdn="engineering"
```

and 

```
 user  bin/proxy 
level=info ts=2017-10-03T09:10:19.78520441Z caller=proxy.go:104 msg=Listening address=:8080
```

**Comment by Rudd-O** [comment]
Found the bug!

```
14:37:52.252929 IP6 (flowlabel 0x15289, hlim 64, next-header TCP (6) payload length: 20) localhost.45382 > localhost.webcache: Flags [.], cksum 0x001c (incorrect -> 0xb091), seq 1, ack 1, win 683, length 0
`.R....@.................................F..Qo..g.~qP.......
14:37:52.253125 IP6 (flowlabel 0x15289, hlim 64, next-header TCP (6) payload length: 167) localhost.45382 > localhost.webcache: Flags [P.], cksum 0x00af (incorrect -> 0x3fcb), seq 1:148, ack 1, win 683, length 147: HTTP, length: 147
	POST //poll HTTP/1.1
	Host: engineering:8080
	User-Agent: Go-http-client/1.1
	Content-Length: 9
	Content-Type: 
	Accept-Encoding: gzip
	
	localhost[!http]
`.R....@.................................F..Qo..g.~qP.......POST //poll HTTP/1.1
Host: engineering:8080
User-Agent: Go-http-client/1.1
Content-Length: 9
Content-Type: 
Accept-Encoding: gzip

localhost
14:37:52.253136 IP6 (flowlabel 0x2a7e9, hlim 64, next-header TCP (6) payload length: 20) localhost.webcache > localhost.45382: Flags [.], cksum 0x001c (incorrect -> 0xafed), seq 1, ack 148, win 700, length 0
`......@...................................Fg.~qQo.cP.......
14:37:52.253346 IP6 (flowlabel 0x2a7e9, hlim 64, next-header TCP (6) payload length: 168) localhost.webcache > localhost.45382: Flags [P.], cksum 0x00b0 (incorrect -> 0x0b5e), seq 1:149, ack 148, win 700, length 148: HTTP, length: 148
	HTTP/1.1 301 Moved Permanently
	Location: /poll
	Date: Tue, 03 Oct 2017 12:37:52 GMT
	Content-Length: 0
	Content-Type: text/plain; charset=utf-8
	
`......@...................................Fg.~qQo.cP.......HTTP/1.1 301 Moved Permanently
Location: /poll
Date: Tue, 03 Oct 2017 12:37:52 GMT
Content-Length: 0
Content-Type: text/plain; charset=utf-8


14:37:52.253357 IP6 (flowlabel 0x15289, hlim 64, next-header TCP (6) payload length: 20) localhost.45382 > localhost.webcache: Flags [.], cksum 0x001c (incorrect -> 0xaf59), seq 148, ack 149, win 700, length 0
`.R....@.................................F..Qo.cg...P.......
14:37:52.253485 IP6 (flowlabel 0x15289, hlim 64, next-header TCP (6) payload length: 177) localhost.45382 > localhost.webcache: Flags [P.], cksum 0x00b9 (incorrect -> 0xb147), seq 148:305, ack 149, win 700, length 157: HTTP, length: 157
	GET /poll HTTP/1.1
	Host: engineering:8080
	User-Agent: Go-http-client/1.1
	Content-Type: 
	Referer: http://engineering:8080//poll
	Accept-Encoding: gzip
	
`.R....@.................................F..Qo.cg...P.......GET /poll HTTP/1.1
```

See?  There's a redirect from `//poll` to `/poll` which the client follows while implicitly converting to a `GET`.


if the URL in the cmd line is http://localhost:8080/, then the URL is being concatenated without removing the forward slash of `/poll`, and that causes problems.  Without the ending forward slash in the URL, it works.

What would be the fix?
